{
  "$schema": "https://json-schema.org/draft/2020-12/schema",
  "title": "Pentest Note",
  "type": "object",
  "required": [
    "title",
    "timestamp_utc",
    "query",
    "next_steps",
    "tool_warnings",
    "evidence_pointers"
  ],
  "properties": {
    "title": {
      "type": "string",
      "minLength": 1
    },
    "timestamp_utc": {
      "type": "string",
      "format": "date-time"
    },
    "query": {
      "type": "string",
      "minLength": 1
    },
    "target": {
      "type": "string"
    },
    "note": {
      "type": "string"
    },
    "commands": {
      "type": "object",
      "additionalProperties": {
        "type": "string"
      }
    },
    "open_ports": {
      "type": "array",
      "items": {
        "type": "object",
        "properties": {
          "port": {
            "type": "integer"
          },
          "service": {
            "type": "string"
          },
          "extra": {
            "type": "string"
          }
        },
        "required": [
          "port",
          "service"
        ],
        "additionalProperties": true
      }
    },
    "web_fingerprints": {
      "type": "array",
      "items": {
        "type": "object",
        "additionalProperties": true
      }
    },
    "ffuf_hits": {
      "type": "array",
      "items": {
        "type": "object",
        "additionalProperties": true
      }
    },
    "next_steps": {
      "type": "array",
      "items": {
        "type": "string",
        "minLength": 1
      },
      "minItems": 1
    },
    "related_knowledge": {
      "type": "array",
      "items": {
        "type": "object",
        "additionalProperties": true
      }
    },
    "tool_warnings": {
      "type": "array",
      "items": {
        "type": "string"
      }
    },
    "evidence_pointers": {
      "type": "array",
      "items": {
        "type": "object",
        "properties": {
          "timestamp_utc": {
            "type": "string",
            "format": "date-time"
          },
          "source_log_line": {
            "type": "string"
          },
          "artifact_path": {
            "type": "string"
          },
          "returncode": {
            "type": "string"
          }
        },
        "required": [
          "timestamp_utc",
          "source_log_line"
        ],
        "additionalProperties": true
      }
    },
    "raw_excerpt": {
      "type": "string"
    }
  },
  "additionalProperties": true
}
