{
  "title": "Recon - 10.10.10.10",
  "timestamp_utc": "2026-03-05T19:41:25.622084+00:00",
  "target": "10.10.10.10",
  "query": "nmap recon on 10.10.10.10",
  "commands": {
    "nmap": "nmap -sV -Pn 10.10.10.10",
    "whatweb": "whatweb http://10.10.10.10",
    "ffuf": "ffuf -w <wordlist> -u http://10.10.10.10/FUZZ -mc 200,204,301,302,307,401,403"
  },
  "open_ports": [],
  "web_fingerprints": [],
  "ffuf_hits": [],
  "next_steps": [
    "No strong category match yet. Continue baseline service and content enumeration.",
    "Keep activity limited to explicitly authorized lab/CTF scope."
  ],
  "related_knowledge": [],
  "tool_warnings": [
    "Active scan disabled. Set AICL_ENABLE_ACTIVE_SCAN=true to execute live tools."
  ],
  "evidence_pointers": [],
  "raw_excerpt": ""
}