{
  "title": "Pentest Planning",
  "timestamp_utc": "2026-03-05T20:31:19.914520+00:00",
  "query": "report writeup markdown for project ctf-154-57-164-76-32105 using existing notes",
  "note": "No target extracted. Provide IP/FQDN for parser-driven recommendations.",
  "next_steps": [
    "Define authorized target and scope.",
    "Run baseline enumeration and ingest output into this agent."
  ],
  "tool_warnings": [],
  "evidence_pointers": []
}