{
  "title": "Pentest Planning",
  "timestamp_utc": "2026-03-05T20:31:14.912678+00:00",
  "query": "writeup project ctf-154-57-164-76-32105 from pentest findings and artifacts",
  "note": "No target extracted. Provide IP/FQDN for parser-driven recommendations.",
  "next_steps": [
    "Define authorized target and scope.",
    "Run baseline enumeration and ingest output into this agent."
  ],
  "tool_warnings": [],
  "evidence_pointers": []
}