{
  "title": "Recon - 154.57.164.76",
  "timestamp_utc": "2026-03-05T20:39:49.858130+00:00",
  "target": "154.57.164.76",
  "query": "ctf recon target 154.57.164.76 ports 32105. artifacts in data/projects/ctf-154-57-164-76-32105/artifacts. open ports observed: 8008,8020,30021,30092,30093,30098,30113,30117,30123,30124,30133,30134,30135,30138,30147,30153,30155,30158,30160,30163,30173,30177,30187,30192,30193,30206,30213,30220,30231,30243,30246,30252,30263,30268,30271,30284,30286,30290,30299,30303,30339,30344,30376,30377,30388,30395,30396,30402,30411,30446,30447,30460,30466,30469,30471,30480,30485,30494,30496,30498,30511,30516,30519,30534,30537,30562,30581,30595,30601,30606,30607,30624,30634,30635,30638,30640,30671,30679,30680,30693,30696,30731,30737,30738,30762,30763,30767,30799,30804,30805,30809,30816,30820,30833,30837,30842,30847,30851,30856,30867,30868,30871,30877,30892,30908,30927,30941,30946,30954,30993,30998,31000,31005,31044,31055,31057,31088,31089,31119,31120,31121,31125,31135,31144,31154,31161,31175,31181,31212,31215,31216,31228,31231,31240,31242,31243,31244,31247,31251,31267,31274,31285,31288,31291,31306,31324,31338,31351,31366,31367,31375,31401,31407,31420,31421,31431,31432,31433,31440,31445,31464,31476,31489,31492,31509,31510,31546,31549,31555,31575,31578,31580,31584,31585,31600,31604,31672,31677,31687,31722,31733,31737,31738,31740,31747,31766,31767,31774,31777,31789,31794,31796,31798,31818,31821,31830,31832,31834,31846,31869,31876,31892,31896,31908,31918,31922,31924,31934,31940,31951,31957,31959,31968,31982,31991,31992,32011,32019,32023,32030,32040,32041,32044,32087,32088,32095,32097,32099,32100,32124,32128,32138,32143,32162,32173,32177,32179,32181,32186,32193,32200,32201,32208,32222,32228,32229,32254,32264,32266,32269,32296,32303,32313,32315,32324,32325,32333,32338,32342,32347,32368,32370,32372,32376,32383,32384,32396,32414,32422,32431,32445,32455,32480,32492,32501,32505,32510,32523,32532,32534,32554,32558,32572,32573,32580,32610,32611,32617,32618,32623,32628,32650,32651,32657,32661,32668,32670,32678,32685,32703,32713,32723,32724,32725,32737,32738,32763,32766. generate next-step pentest notes.",
  "commands": {
    "nmap": "nmap -sV -Pn 154.57.164.76",
    "whatweb": "whatweb http://154.57.164.76",
    "ffuf": "ffuf -w <wordlist> -u http://154.57.164.76/FUZZ -mc 200,204,301,302,307,401,403"
  },
  "open_ports": [],
  "web_fingerprints": [],
  "ffuf_hits": [],
  "next_steps": [
    "No strong category match yet. Continue baseline service and content enumeration.",
    "Keep activity limited to explicitly authorized lab/CTF scope."
  ],
  "related_knowledge": [],
  "tool_warnings": [
    "Active scan disabled. Set AICL_ENABLE_ACTIVE_SCAN=true to execute live tools."
  ],
  "evidence_pointers": [],
  "raw_excerpt": ""
}